{
  "schema_version": 2,
  "status": "resolved",
  "pass_id": "example-detached-pass",
  "target_path": "reviews/examples/artifacts/target.valid.md",
  "target_revision": "git:73eaed921475be235f6684abdd2ce19a4e367c7f",
  "review_input_path": "reviews/examples/review-input.valid.json",
  "review_input_revision": "sha256:dc29a2b9712d8555b2b607998bd97d25cc3a61dbc0e447dd8dee1865a6c3833d",
  "policy_path": "reviews/manifests/lens-selection.json",
  "policy_revision": "git:2055e9524aa663b94b4e9462dac656b8959e6575",
  "mode": "explicit",
  "matched_domains": [],
  "deterministic_lenses": ["implementation"],
  "llm_proposal_path": null,
  "llm_proposal_revision": null,
  "llm_additions": [],
  "selected_lenses": ["implementation"]
}
